{
  "schema_version": "project-graph/context-pack/v1",
  "pack_id": "pack-orders-flow-v1",
  "operation": "trace",
  "envelope": {
    "schema_version": "project-graph/context/v1",
    "project": {
      "repository_id": "orders",
      "worktree_id": "main",
      "git_head": "head",
      "working_tree_fingerprint": "tree",
      "config_hash": "config",
      "ignore_policy_version": "ignore-v1"
    },
    "graph_version": "graph-v1",
    "revision": "head",
    "view": "flow",
    "query": "How does POST /orders reach the database?",
    "source_is_untrusted": true,
    "nodes": [],
    "edges": [],
    "code_slices": [],
    "evidence": [],
    "coverage": {"status": "partial", "unknowns": []},
    "budget": {
      "max_nodes": 40,
      "max_edges": 80,
      "max_source_ranges": 20,
      "max_source_bytes": 100000,
      "max_traversal_depth": 5,
      "max_serialized_bytes": 18000,
      "max_characters": 16000,
      "max_tokens": 4000,
      "tokenizer": "project-tokenizer-v1",
      "emitted_nodes": 0,
      "emitted_edges": 0,
      "emitted_source_ranges": 0,
      "emitted_source_bytes": 0,
      "emitted_serialized_bytes": 1200,
      "emitted_characters": 900,
      "emitted_tokens": 200,
      "truncated": false
    },
    "extensions": {}
  },
  "scope": {
    "project": {
      "repository_id": "orders",
      "worktree_id": "main",
      "git_head": "head",
      "working_tree_fingerprint": "tree",
      "config_hash": "config",
      "ignore_policy_version": "ignore-v1"
    },
    "graph_version": "graph-v1",
    "paths": ["src"],
    "node_ids": ["route:post-orders"],
    "max_depth": 5
  },
  "grant": {
    "grant_id": "grant-orders-v1",
    "issuer": "harness",
    "subject": "worker-luna-1",
    "role": "flow-tracer",
    "scope": {
      "project": {
        "repository_id": "orders",
        "worktree_id": "main",
        "git_head": "head",
        "working_tree_fingerprint": "tree",
        "config_hash": "config",
        "ignore_policy_version": "ignore-v1"
      },
      "graph_version": "graph-v1",
      "paths": ["src"],
      "node_ids": ["route:post-orders"],
      "max_depth": 5
    },
    "capabilities": ["read_graph", "read_source", "submit_claims"],
    "issued_at_ms": 1000,
    "expires_at_ms": 2000,
    "parent_grant_id": null
  },
  "handoff": null,
  "untrusted_content": {"origins": ["source", "tool_output"]},
  "extensions": {}
}
